update_id,as_of_date,category,headline,summary,relevance
M001,2025-03-14,Equity,US large caps extend gains,Strong earnings and Fed hold support equities; S&P +2.1% MTD.,All equity-heavy clients
M002,2025-03-14,Fixed Income,Yields edge higher on inflation data,10Y Treasury at 4.25%; CPI slightly above expectations. Bond prices under pressure.,Fixed income and retirement income
M003,2025-03-13,Regulation,SEC climate disclosure update,New rules phase in from 2025; may affect reporting for certain holdings.,Compliance and ESG-focused clients
M004,2025-03-12,International,EM rally continues,EM equity index up 4% MTD; dollar weakness supports.,International allocation clients
M005,2025-03-11,Tax,Estimated tax deadline reminder,Q1 estimated tax due 4/15; consider withholding adjustments for high-income clients.,Tax-sensitive clients
